{
  "title": "Digital Banking Microservices System",
  "diagram_type": "architecture",
  "direction": "LR",
  "groups": [
    {
      "id": "digital_banking_system",
      "label": "Digital Banking System"
    }
  ],
  "nodes": [
    {
      "id": "client",
      "label": "Client",
      "type": "actor"
    },
    {
      "id": "user",
      "label": "User",
      "type": "actor"
    },
    {
      "id": "api_gateway",
      "label": "API Gateway",
      "type": "gateway",
      "group": "digital_banking_system"
    },
    {
      "id": "account_service",
      "label": "Account Service",
      "type": "service",
      "group": "digital_banking_system"
    },
    {
      "id": "transaction_service",
      "label": "Transaction Service",
      "type": "service",
      "group": "digital_banking_system"
    },
    {
      "id": "fraud_detection_service",
      "label": "Fraud Detection Service",
      "type": "service",
      "group": "digital_banking_system"
    },
    {
      "id": "notification_service",
      "label": "Notification Service",
      "type": "service",
      "group": "digital_banking_system"
    },
    {
      "id": "payment_service",
      "label": "Payment Service",
      "type": "service",
      "group": "digital_banking_system"
    },
    {
      "id": "kafka",
      "label": "Apache Kafka",
      "type": "message_broker"
    },
    {
      "id": "redis_cache",
      "label": "Redis Cache",
      "type": "database"
    },
    {
      "id": "databases",
      "label": "Databases",
      "type": "database"
    },
    {
      "id": "zookeeper",
      "label": "Zookeeper",
      "type": "service"
    },
    {
      "id": "payment_gateway",
      "label": "Payment Gateway",
      "type": "external_system"
    }
  ],
  "edges": [
    {
      "source": "transaction_service",
      "target": "kafka",
      "label": "Publishes event for fraud detection"
    },
    {
      "source": "kafka",
      "target": "fraud_detection_service",
      "label": "Event for fraud detection"
    }
  ]
}
