{
  "title": "Order Processing Architecture",
  "diagram_type": "architecture",
  "direction": "LR",
  "nodes": [
    { "id": "customers", "label": "Customers", "type": "actor", "icon": "generic" },
    { "id": "mobile_application", "label": "Mobile Application", "type": "application", "icon": "generic" },
    { "id": "order_api", "label": "Order API", "type": "service", "icon": "generic" },
    { "id": "order_processing_service", "label": "Order Processing Service", "type": "service", "icon": "generic" },
    { "id": "relational_database", "label": "Relational Database", "type": "database", "icon": "generic" },
    { "id": "message_broker", "label": "Message Broker", "type": "message_broker", "icon": "generic" },
    { "id": "inventory_service", "label": "Inventory Service", "type": "service", "icon": "generic" },
    { "id": "external_warehouse_system", "label": "External Warehouse System", "type": "external_system", "icon": "generic" }
  ],
  "edges": [
    { "source": "customers", "target": "mobile_application", "label": "Places orders" },
    { "source": "mobile_application", "target": "order_api", "label": "Order requests" },
    { "source": "order_api", "target": "order_processing_service", "label": "Valid orders" },
    { "source": "order_processing_service", "target": "relational_database", "label": "Stores order data" },
    { "source": "order_processing_service", "target": "message_broker", "label": "Publishes OrderCreated event" },
    { "source": "message_broker", "target": "inventory_service", "label": "OrderCreated event" },
    { "source": "inventory_service", "target": "external_warehouse_system" }
  ]
}
